{
  "name": "tk-fixture-marketplace",
  "description": "Fixture marketplace for the tk contract tests",
  "owner": { "name": "Aetius Gular" },
  "plugins": [
    {
      "name": "tk-fixture-bundle",
      "description": "One skill",
      "source": {
        "source": "git-subdir",
        "url": "https://github.com/aetiusgular/tk.git",
        "path": "contracts/fixtures/entry/bundle",
        "ref": "main",
        "sha": "0000000000000000000000000000000000000000"
      }
    }
  ]
}
